{
  "version": "1",
  "title": "Upper Body Strength & Mobility – Block 3, Week 4 (Deload, Tuesday)",
  "date": "2025-09-30",
  "block": 3,
  "week": 4,
  "notes": "Deload focus: reduce total volume and RPE (mostly 6–7). Maintain movement quality and scapular control. Keep overhead stress low (landmine/neutral grips). No carries this week to keep foot fully calm.",
  "sections": [
    {
      "type": "Warm-up",
      "title": "Prep (6–7 min)",
      "notes": "Light scap + chest open; no fatigue.",
      "items": [
        { "kind": "exercise", "name": "Arm Circles", "link": "exercises/arm_circles.json", "logType": "mobility", "prescription": { "timeSeconds": 40 }, "cues": ["Both directions", "Relax neck"] },
        { "kind": "exercise", "name": "Band Pull-Aparts", "link": "exercises/band_pull_aparts.json", "logType": "strength", "prescription": { "sets": 1, "reps": 15 }, "cues": ["Scaps glide", "Soft elbows"] },
        { "kind": "exercise", "name": "Pallof Press", "link": "exercises/pallof_press.json", "logType": "strength", "prescription": { "sets": 1, "reps": "8/side" }, "cues": ["Brace + exhale", "No rotation"] }
      ]
    },
    {
      "type": "Strength",
      "title": "A1/A2 Press + Row (Alt)",
      "notes": "Alternate; ~60–70s between movements. Keep RPE ≤7.",
      "items": [
        { "kind": "exercise", "name": "Neutral-Grip Flat Bench Press (Dumbbells)", "link": "exercises/neutral_grip_flat_bench_press.json", "logType": "strength", "prescription": { "sets": 3, "reps": 8, "weight": "45–50 lb per hand", "rpe": 7, "restSeconds": 70 }, "cues": ["Wrists neutral", "Drive evenly", "Shoulder blades set"] },
        { "kind": "exercise", "name": "One-Arm Dumbbell Row (Bench Supported)", "link": "exercises/one_arm_dumbbell_row.json", "logType": "strength", "prescription": { "sets": 3, "reps": "8–9/side", "weight": "45–50 lb", "rpe": 7, "restSeconds": 70 }, "cues": ["Elbow tight path", "Pause squeeze", "Neck neutral"] }
      ]
    },
    {
      "type": "Main Work",
      "title": "B1/B2 Incline + Chest-Supported Row",
      "notes": "Keep tempo controlled; stop 3 reps shy of failure.",
      "items": [
        { "kind": "exercise", "name": "Incline Landmine Press", "link": "exercises/incline_landmine_press.json", "logType": "strength", "prescription": { "sets": 2, "reps": "10/side", "rpe": 7, "restSeconds": 60 }, "cues": ["Arc press", "Ribs down", "Controlled lower"] },
        { "kind": "exercise", "name": "Chest-Supported Dumbbell Row", "link": "exercises/chest_supported_dumbbell_row.json", "logType": "strength", "prescription": { "sets": 2, "reps": 10, "weight": "30–35 lb per hand", "restSeconds": 60 }, "cues": ["No shrug", "Elbows drive back", "Squeeze mid-back"] }
      ]
    },
    {
      "type": "Accessory/Core",
      "title": "C – Light Pump + Core",
      "notes": "Short rests ~20s; 1–2 easy rounds.",
      "items": [
        { "kind": "exercise", "name": "Hammer Curl", "link": "exercises/hammer_curl.json", "logType": "strength", "prescription": { "sets": 2, "reps": 12, "weight": "20–22.5 lb per hand" }, "cues": ["Elbows stay", "Controlled lower"] },
        { "kind": "exercise", "name": "Overhead Triceps Extension", "link": "exercises/overhead_triceps_extension.json", "logType": "strength", "prescription": { "sets": 2, "reps": 12, "weight": "15–20 lb" }, "cues": ["Elbows narrow", "Soft lockout"] },
        { "kind": "exercise", "name": "Deadbug", "link": "exercises/deadbug.json", "logType": "strength", "prescription": { "sets": 2, "reps": "6–8/side" }, "cues": ["Exhale press", "Low back neutral"] }
      ]
    },
    {
      "type": "Cooldown/Recovery",
      "title": "Downshift (5–6 min)",
      "items": [
        { "kind": "exercise", "name": "Child’s Pose", "link": "exercises/childs_pose.json", "logType": "stretch", "prescription": { "holdSeconds": 50 }, "cues": ["Melt hips back"] },
        { "kind": "exercise", "name": "Thread the Needle", "link": "exercises/thread_the_needle.json", "logType": "stretch", "prescription": { "holdSeconds": 45 }, "cues": ["Reach long", "Gentle rotate"] },
        { "kind": "exercise", "name": "Seated Forward Fold", "link": "exercises/seated_forward_fold.json", "logType": "stretch", "prescription": { "holdSeconds": 50 }, "cues": ["Long spine", "Exhale soften"] }
      ]
    }
  ]
}