{
  "version": "1",
  "title": "Lower Body Strength & Mobility",
  "date": "2025-08-27",
  "block": 2,
  "week": 3,
  "sections": [
    {
      "type": "Warm-up",
      "title": "Warm-up",
      "items": [
        {
          "kind": "exercise",
          "name": "Bodyweight Squat",
          "link": "exercises/bodyweight_squat.json",
          "prescription": {
            "sets": 2,
            "reps": 10
          },
          "cues": [
            "[Glute Bridge](../exercises/glute_bridge.json): 2 x 10",
            "[World\u2019s Greatest Stretch](../exercises/worlds_greatest_stretch.json): 4/side"
          ]
        },
        {
          "kind": "exercise",
          "name": "Glute Bridge",
          "link": "exercises/glute_bridge.json",
          "prescription": {
            "sets": 2,
            "reps": 10
          },
          "cues": [
            "[World\u2019s Greatest Stretch](../exercises/worlds_greatest_stretch.json): 4/side"
          ]
        },
        {
          "kind": "exercise",
          "name": "World\u2019s Greatest Stretch",
          "link": "exercises/worlds_greatest_stretch.json",
          "prescription": {
            "reps": 4
          }
        }
      ]
    },
    {
      "type": "Main Work",
      "title": "Main Work",
      "items": [
        {
          "kind": "exercise",
          "name": "Goblet Squat",
          "link": "exercises/goblet_squat.json",
          "prescription": {
            "sets": 4,
            "reps": "6\u20138",
            "weight": "60 lb",
            "restSeconds": 90
          },
          "cues": [
            "4 x 6\u20138 @ 60 lb, Rest 90 sec",
            "Cues:",
            "Brace and keep chest tall",
            "Knees track over toes",
            "Pause briefly at bottom; drive through mid-foot"
          ]
        },
        {
          "kind": "exercise",
          "name": "Dumbbell Romanian Deadlift",
          "link": "exercises/dumbbell_romanian_deadlift.json",
          "prescription": {
            "sets": 4,
            "reps": "8\u201310",
            "weight": "57.5 lb per hand",
            "restSeconds": 90
          },
          "cues": [
            "4 x 8\u201310 @ 57.5 lb per hand, Rest 90 sec",
            "Cues:",
            "Soft knees, hinge at hips",
            "Back flat, lats tight",
            "Squeeze glutes to stand"
          ]
        },
        {
          "kind": "exercise",
          "name": "Bulgarian Split Squat",
          "link": "exercises/bulgarian_split_squat.json",
          "prescription": {
            "sets": 3,
            "reps": "8\u201310/leg",
            "weight": "27.5\u201330 lb per hand",
            "restSeconds": 75
          },
          "cues": [
            "3 x 8\u201310/leg @ 27.5\u201330 lb per hand, Rest 75 sec",
            "Cues:",
            "Front knee over mid-foot",
            "Slight forward torso, tall posture",
            "Control the bottom\u2014no bounce"
          ]
        },
        {
          "kind": "exercise",
          "name": "Standing Calf Raise",
          "link": "exercises/standing_calf_raise.json",
          "prescription": {
            "sets": 3,
            "reps": "12\u201315",
            "weight": "bodyweight or 15 lb per hand",
            "restSeconds": 45
          },
          "cues": [
            "3 x 12\u201315 @ bodyweight or 15 lb per hand, Rest 45 sec",
            "Cues:",
            "Pause at top 1 sec",
            "Slow lower\u2014full range"
          ]
        }
      ]
    },
    {
      "type": "Accessory/Core",
      "title": "Accessory/Core",
      "items": [
        {
          "kind": "exercise",
          "name": "Side Plank",
          "link": "exercises/side_plank.json",
          "prescription": {
            "sets": 2,
            "timeSeconds": 45,
            "restSeconds": 45
          }
        }
      ]
    },
    {
      "type": "Cooldown/Recovery",
      "title": "Cooldown/Recovery",
      "items": [
        {
          "kind": "exercise",
          "name": "90/90 Hip Stretch",
          "link": "exercises/90_90_hip_stretch.json",
          "prescription": {
            "holdSeconds": 60
          },
          "cues": [
            "[Lying Spinal Twist](../exercises/lying_spinal_twist.json): 1 min/side",
            "[Seated Forward Fold](../exercises/seated_forward_fold.json): 1 min"
          ]
        },
        {
          "kind": "exercise",
          "name": "Lying Spinal Twist",
          "link": "exercises/lying_spinal_twist.json",
          "prescription": {
            "holdSeconds": 60
          },
          "cues": [
            "[Seated Forward Fold](../exercises/seated_forward_fold.json): 1 min"
          ]
        },
        {
          "kind": "exercise",
          "name": "Seated Forward Fold",
          "link": "exercises/seated_forward_fold.json",
          "prescription": {
            "holdSeconds": 60
          }
        }
      ]
    }
  ]
}