{
  "version": "1",
  "title": "Upper Body Hypertrophy – Block 3, Week 3 (Tuesday)",
  "date": "2025-09-23",
  "block": 3,
  "week": 3,
  "notes": "Block 3 W3 (peak hypertrophy before slight taper W4): Mild progressive overload vs W2 while keeping RPE mostly ≤8. Maintain reduced overhead stress (landmine vs vertical). Right foot still slightly sensitive: no loaded carries today (avoid extra foot impact); seated or supported where helpful. Prior W2 loads largely at RPE 8 target; progress primarily via small rep bracket bump or an added quality top set without increasing all sets' fatigue. Arm circuit volume caps to avoid elbow irritation.",
  "sections": [
    {
      "type": "Warm-up",
      "title": "Prep (6–7 min)",
      "notes": "Scap + chest open + light core brace; minimal fatigue.",
      "items": [
        { "kind": "exercise", "name": "Arm Circles", "link": "exercises/arm_circles.json", "logType": "mobility", "prescription": { "timeSeconds": 45 }, "cues": ["Both directions", "Relax neck"] },
        { "kind": "exercise", "name": "Band Pull-Aparts", "link": "exercises/band_pull_aparts.json", "logType": "strength", "prescription": { "sets": 1, "reps": 20 }, "cues": ["Scaps glide", "Soft elbows"] },
        { "kind": "exercise", "name": "Cat-Cow to Cobra Stretch", "link": "exercises/cat_cow_to_cobra_stretch.json", "logType": "mobility", "prescription": { "reps": 6 }, "cues": ["Segment spine", "Slow breath"] },
        { "kind": "exercise", "name": "Pallof Press", "link": "exercises/pallof_press.json", "logType": "strength", "prescription": { "sets": 1, "reps": "8/side" }, "cues": ["Brace + exhale", "No rotation"] }
      ]
    },
    {
      "type": "Strength",
      "title": "A1/A2 Alt Press + Row (Primary)",
      "notes": "Alternate; ~75s between movements. Progression: Hold load; add 1 rep to prior top end if RPE allows (avoid jumping to heavier rung yet). Stop early if RPE >8.",
      "items": [
  { "kind": "exercise", "name": "Neutral-Grip Flat Bench Press (Dumbbells)", "link": "exercises/neutral_grip_flat_bench_press.json", "logType": "strength", "prescription": { "sets": 4, "reps": "9–10", "weight": "50 lb per hand", "rpe": 8, "restSeconds": 75 }, "cues": ["Wrists neutral", "Drive evenly", "Shoulder blades set"] },
  { "kind": "exercise", "name": "One-Arm Dumbbell Row (Bench Supported)", "link": "exercises/one_arm_dumbbell_row.json", "logType": "strength", "prescription": { "sets": 4, "reps": "9–10/side", "weight": "50 lb", "rpe": 8, "restSeconds": 75 }, "cues": ["Elbow tight path", "Pause squeeze", "Neck neutral"] }
      ]
    },
    {
      "type": "Main Work",
      "title": "B1/B2 Incline + Chest-Supported Row",
      "notes": "Slight density increase: maintain sets, micro-load via added reps or 1s squeeze pause.",
      "items": [
  { "kind": "exercise", "name": "Incline Landmine Press", "link": "exercises/incline_landmine_press.json", "logType": "strength", "prescription": { "sets": 4, "reps": "10–11/side", "weight": "25–35 lb per hand", "rpe": 8, "restSeconds": 60 }, "cues": ["Arc press", "Ribs down", "Controlled lower"] },
  { "kind": "exercise", "name": "Chest-Supported Dumbbell Row", "link": "exercises/chest_supported_dumbbell_row.json", "logType": "strength", "prescription": { "sets": 4, "reps": 10, "weight": "35 lb per hand", "restSeconds": 60 }, "cues": ["No shrug", "Elbows drive back", "Squeeze mid-back"] }
      ]
    },
    {
      "type": "Accessory/Core",
      "title": "C1/C2/C3 Pump Circuit (2–3 Rounds)",
      "notes": "~20–25s between moves; 60s after each round. No carries today (foot).",
      "items": [
  { "kind": "exercise", "name": "Hammer Curl", "link": "exercises/hammer_curl.json", "logType": "strength", "prescription": { "sets": 3, "reps": 12, "weight": "22.5 lb per hand" }, "cues": ["Elbows stay", "Controlled lower"] },
  { "kind": "exercise", "name": "Overhead Triceps Extension", "link": "exercises/overhead_triceps_extension.json", "logType": "strength", "prescription": { "sets": 3, "reps": 12, "weight": "20 lb" }, "cues": ["Elbows narrow", "Soft lockout"] },
  { "kind": "exercise", "name": "Reverse Fly (Chest-Supported)", "link": "exercises/reverse_fly_chest_supported.json", "logType": "strength", "prescription": { "sets": 3, "reps": 15, "weight": "10 lb per hand" }, "cues": ["Wide arc", "No neck tension"] }
      ]
    },
    {
      "type": "Cooldown/Recovery",
      "title": "Downshift (5–6 min)",
      "items": [
        { "kind": "exercise", "name": "Child’s Pose", "link": "exercises/childs_pose.json", "logType": "stretch", "prescription": { "holdSeconds": 50 }, "cues": ["Melt hips back"] },
        { "kind": "exercise", "name": "Thread the Needle", "link": "exercises/thread_the_needle.json", "logType": "stretch", "prescription": { "holdSeconds": 45 }, "cues": ["Reach long", "Gentle rotate"] },
        { "kind": "exercise", "name": "Seated Forward Fold", "link": "exercises/seated_forward_fold.json", "logType": "stretch", "prescription": { "holdSeconds": 50 }, "cues": ["Long spine", "Exhale soften"] }
      ]
    }
  ]
}
