{
  "version": "1",
  "title": "Lower Body Strength & Calves – Block 3, Week 3 (Thursday)",
  "date": "2025-09-25",
  "block": 3,
  "week": 3,
  "notes": "Week 3 after partial deload of foot (skipped W2 squat stress). Rebuild intensity conservatively: use W1 loads/volumes with small rep extension on final set only if pain-free (lateral right foot ≤2/10). No loaded carries. Focus crisp hinge + single-leg control. RPE cap 7–8 on primary sets.",
  "sections": [
    {
      "type": "Warm-up",
      "title": "Prep (8–9 min)",
      "notes": "Gradual tissue temp + ankle activation; avoid fatigue.",
      "items": [
        { "kind": "exercise", "name": "Jumping Jacks", "link": "exercises/jumping_jacks.json", "logType": "endurance", "prescription": { "timeSeconds": 35 }, "cues": ["Light impact", "Rhythm"] },
        { "kind": "exercise", "name": "Leg Swings", "link": "exercises/leg_swings.json", "logType": "mobility", "prescription": { "reps": "10/leg fwd-back + 10 side" }, "cues": ["Tall posture"] },
        { "kind": "exercise", "name": "Goblet Squat", "link": "exercises/goblet_squat.json", "logType": "strength", "prescription": { "sets": 1, "reps": 8, "weight": "25 lb" }, "cues": ["Brace light", "Knees track"] },
        { "kind": "exercise", "name": "Short Foot (Arch Raise)", "link": "exercises/short_foot_arch_raise.json", "logType": "strength", "prescription": { "sets": 1, "reps": "8/side" }, "cues": ["Lift arch", "No toe curl"] }
      ]
    },
    {
      "type": "Strength",
      "title": "A – Primary Squat",
      "notes": "Match W1 load. Optional +1 rep only on final set if RPE ≤7 and foot quiet.",
      "items": [
        { "kind": "exercise", "name": "Goblet Squat", "link": "exercises/goblet_squat.json", "logType": "strength", "prescription": { "sets": 3, "reps": 8, "weight": "45 lb", "rpe": 7, "restSeconds": 90 }, "cues": ["Elbows down", "Mid-foot pressure", "Own bottom"] }
      ]
    },
    {
      "type": "Main Work",
      "title": "B1/B2 Hinge + Unilateral",
      "notes": "Use W1 loads; add rep only if perfect.",
      "items": [
        { "kind": "exercise", "name": "Dumbbell Romanian Deadlift", "link": "exercises/dumbbell_romanian_deadlift.json", "logType": "strength", "prescription": { "sets": 3, "reps": 10, "weight": "40 lb per hand", "rpe": 7, "restSeconds": 60 }, "cues": ["Soft knees", "Hips back", "No shrug"] },
        { "kind": "exercise", "name": "Bulgarian Split Squat", "link": "exercises/bulgarian_split_squat.json", "logType": "strength", "prescription": { "sets": 3, "reps": "8/leg", "weight": "25 lb per hand", "restSeconds": 60 }, "cues": ["Vertical torso", "Front knee track", "Balance"] }
      ]
    },
    {
      "type": "Accessory/Core",
      "title": "C1/C2/C3 Posterior + Calf + Tibialis (2–3 Rounds)",
      "notes": "Short rests 20–30s between moves; 60s after round.",
      "items": [
        { "kind": "exercise", "name": "Glute Bridge", "link": "exercises/glute_bridge.json", "logType": "strength", "prescription": { "sets": 3, "reps": 12 }, "cues": ["Ribs down", "Squeeze top"] },
        { "kind": "exercise", "name": "Standing Calf Raise (DB)", "link": "exercises/standing_calf_raise_db.json", "logType": "strength", "prescription": { "sets": 3, "reps": 15, "weight": "25 lb per hand" }, "cues": ["Full stretch", "Controlled tempo"] },
        { "kind": "exercise", "name": "Tibialis Raise (Wall Lean)", "link": "exercises/tibialis_raise_wall_lean.json", "logType": "strength", "prescription": { "sets": 3, "reps": 15 }, "cues": ["Toes lift smooth", "No ankle collapse"] }
      ]
    },
    {
      "type": "Accessory/Core",
      "title": "D – Foot Capacity (Optional)",
      "notes": "Skip if any flare. Add single-leg iso only if calm.",
      "items": [
        { "kind": "exercise", "name": "Single-Leg Isometric Calf Raise (Support)", "link": "exercises/single_leg_iso_calf_raise_support.json", "logType": "strength", "prescription": { "sets": 2, "holdSeconds": 20 }, "cues": ["Even forefoot", "Slow lower"] },
        { "kind": "exercise", "name": "Seated Forward Fold", "link": "exercises/seated_forward_fold.json", "logType": "stretch", "prescription": { "holdSeconds": 45 }, "cues": ["Long spine"] }
      ]
    },
    {
      "type": "Cooldown/Recovery",
      "title": "Downshift (5–6 min)",
      "items": [
        { "kind": "exercise", "name": "90/90 Hip Stretch", "link": "exercises/90_90_hip_stretch.json", "logType": "stretch", "prescription": { "holdSeconds": 45 }, "cues": ["Tall posture"] },
        { "kind": "exercise", "name": "Calf Stretch (Wall or Step)", "link": "exercises/calf_stretch_wall_or_step.json", "logType": "stretch", "prescription": { "holdSeconds": 30 }, "cues": ["Easy tension"] },
        { "kind": "exercise", "name": "Child’s Pose", "link": "exercises/childs_pose.json", "logType": "stretch", "prescription": { "holdSeconds": 45 }, "cues": ["Slow exhale"] }
      ]
    }
  ]
}